{
  "$schema": "http://json-schema.org/draft-07/schema#",
  "$id": "https://phimaps.dev/schema/philosopher.schema.json",
  "title": "Philosopher",
  "description": "One philosopher = one JSON file at data/philosophers/{id}.json. k and centrality are DERIVED (Stage 3-4), never hand-filled. All Chinese text MUST be Traditional (繁體); CI rejects simplified characters.",
  "type": "object",
  "additionalProperties": false,
  "required": [
    "id",
    "qid",
    "name_zh",
    "name_en",
    "tradition",
    "centrality",
    "birth_year",
    "date_certainty",
    "active_regions",
    "membership_sources",
    "k"
  ],
  "properties": {
    "id": {
      "type": "string",
      "pattern": "^Q[0-9]+$",
      "description": "Canonical key = Wikidata QID. Semantic-free, decoupled from name (decision: id locked to Q{QID})."
    },
    "qid": {
      "type": "string",
      "pattern": "^Q[0-9]+$",
      "description": "Wikidata entity reference (equals id)."
    },
    "slug": {
      "type": "string",
      "pattern": "^[a-z0-9-]+$",
      "description": "Human-readable URL/display slug. NOT a stable key — derived from name_en, may change."
    },
    "name_zh": {
      "type": ["string", "null"],
      "description": "繁體中文 only. CI runs a simplified-character detector and blocks any simplified glyph. null when no Traditional-Chinese name is established (留白勝過填錯)."
    },
    "name_en": {
      "type": "string"
    },
    "tradition": {
      "type": "string",
      "enum": [
        "greek",
        "chinese",
        "indian",
        "islamic",
        "jewish",
        "european",
        "japanese",
        "korean",
        "african",
        "latin_american",
        "other"
      ],
      "description": "Primary intellectual lineage / canon pool the figure is studied under (not birthplace)."
    },
    "centrality": {
      "type": "string",
      "enum": ["core", "contested", "adjacent"],
      "description": "DERIVED from k (Stage 4). k>=2 -> core. contested (1<=k<2) and adjacent are below K_MIN and do not appear in the atlas. Never hand-filled."
    },
    "review": {
      "type": "boolean",
      "description": "true when k==2.0 (provisional core, single non-Wikidata vote away from threshold). DERIVED."
    },
    "birth_year": {
      "type": ["integer", "null"],
      "description": "BCE is negative (e.g. Socrates = -469). Integer for timeline comparison."
    },
    "death_year": {
      "type": ["integer", "null"]
    },
    "date_certainty": {
      "type": "string",
      "enum": ["exact", "approximate", "uncertain"],
      "description": "DERIVED from Wikidata P569 timePrecision: >=9 (year/month/day) -> exact; 7-8 (century/decade) -> approximate; missing -> uncertain."
    },
    "active_regions": {
      "type": "array",
      "minItems": 1,
      "description": "Map pins. Decision B = multiple precise residences. Each region is a real Wikidata geographic claim (birth P19 / death P20 / work P937 / residence P551). Exactly one region has primary=true (the default map position across the lifespan).",
      "items": {
        "type": "object",
        "additionalProperties": false,
        "required": ["lat", "lon", "anchor", "primary"],
        "properties": {
          "lat": { "type": "number", "minimum": -90, "maximum": 90 },
          "lon": { "type": "number", "minimum": -180, "maximum": 180 },
          "place": { "type": ["string", "null"] },
          "period": {
            "type": ["array", "null"],
            "minItems": 2,
            "maxItems": 2,
            "items": { "type": ["integer", "null"] },
            "description": "[start_year, end_year]. Only filled when Wikidata carries date qualifiers (P580/P582); otherwise null (留白勝過填錯). The primary/birth region defaults to the lifespan for scrubber visibility."
          },
          "anchor": {
            "type": "string",
            "enum": ["birth", "death", "work", "residence"],
            "description": "What this point represents. birth=P19, death=P20, work=P937, residence=P551."
          },
          "source_property": {
            "type": ["string", "null"],
            "enum": ["P19", "P20", "P937", "P551", null],
            "description": "Wikidata property this point was derived from (audit trail)."
          },
          "primary": {
            "type": "boolean",
            "description": "True for the single default map position (the birth anchor). Frontend may override to a work region when the scrubber year falls inside its period."
          },
          "polity_source": {
            "type": ["string", "null"],
            "enum": ["curated", "historical-basemaps", null],
            "description": "Provenance of polity_sequence. 'curated' = hand-verified (exact dates). 'historical-basemaps' = derived by point-in-polygon against aourednik/historical-basemaps time-slices (CC-BY-SA); dates are snapshot-approximate and entity names are dataset-native. null = no polity_sequence."
          },
          "polity_sequence": {
            "type": "array",
            "description": "Polity history of THIS location (chronological). Never a present-day-country label. Empty = not yet researched (留白), NOT 'unknown polity'. Dates are exact when polity_source=curated, snapshot-approximate when historical-basemaps.",
            "items": {
              "type": "object",
              "additionalProperties": false,
              "required": ["polity", "start", "end"],
              "properties": {
                "polity": { "type": "string", "description": "Historical political entity name (e.g. 'Kingdom of Prussia'). No modern-sovereignty labels." },
                "start": { "type": ["integer", "null"] },
                "end": { "type": ["integer", "null"] }
              }
            }
          }
        }
      }
    },
    "membership_sources": {
      "type": "array",
      "minItems": 1,
      "description": "The k evidence chain — the ONLY legitimate source of k and centrality. Empty -> CI warning.",
      "items": {
        "type": "object",
        "additionalProperties": false,
        "required": ["source_id", "entry_type", "weight"],
        "properties": {
          "source_id": {
            "type": "string",
            "enum": ["wikidata", "sep", "iep", "feng_youlan", "lao_siguang", "routledge_series", "adamson"]
          },
          "entry_type": {
            "type": "string",
            "enum": ["dedicated", "topic", "canon_list"],
            "description": "dedicated=1.0, canon_list=1.0, topic=0.5. Same source, highest type wins."
          },
          "weight": { "type": "number", "minimum": 0, "maximum": 1 },
          "raw_name": {
            "type": "string",
            "description": "The name string as it appeared in the source (audit trail)."
          }
        }
      }
    },
    "works": {
      "type": "array",
      "description": "Notable works from Wikidata P800. Independent of k (works do NOT affect inclusion or centrality).",
      "items": {
        "type": "object",
        "additionalProperties": false,
        "required": ["title", "source"],
        "properties": {
          "title": { "type": "string", "description": "English/original title (falls back to Wikidata QID if unlabelled)." },
          "title_zh": { "type": ["string", "null"], "description": "繁體中文 title if available." },
          "year": { "type": ["integer", "null"], "description": "Inception/publication year (P577); BCE negative." },
          "qid": { "type": ["string", "null"], "description": "Wikidata entity of the work." },
          "source": { "type": "string", "enum": ["wikidata"] }
        }
      }
    },
    "works_sources": {
      "type": "array",
      "description": "Sources that verify works[] (Wikidata P800; ctext deferred pending API key). Do NOT count toward k. Separate channel.",
      "items": {
        "type": "object",
        "additionalProperties": false,
        "required": ["source"],
        "properties": {
          "source": { "type": "string", "enum": ["wikidata", "ctext"] },
          "ref": { "type": ["string", "null"], "description": "e.g. 'P800' or a ctext URN." },
          "note": { "type": ["string", "null"] }
        }
      }
    },
    "k": {
      "type": "number",
      "minimum": 2,
      "description": "DERIVED: sum of distinct source weights. Atlas inclusion requires k >= K_MIN (2.0)."
    },
    "sitelinks": {
      "type": ["integer", "null"],
      "description": "Wikidata sitelink count (notability proxy, English-biased — do not use to silently drop non-Western figures)."
    },
    "birth_place": {
      "type": ["string", "null"]
    },
    "description": {
      "type": ["string", "null"],
      "description": "One-line descriptor from Wikidata (schema:description). zh-hant preferred, opencc-converted zh, else en fallback."
    },
    "bio": {
      "type": ["string", "null"],
      "description": "Intro paragraph from zh Wikipedia (opencc -> Traditional, trimmed ~600 chars). CC-BY-SA. null = no zh Wikipedia article (留白)."
    },
    "bio_source": {
      "type": ["string", "null"],
      "enum": ["zhwiki", null],
      "description": "Provenance of bio. Currently only zh Wikipedia."
    },
    "description_en": {
      "type": ["string", "null"],
      "description": "One-line English descriptor from Wikidata (schema:description@en). For bilingual/English mode."
    },
    "bio_en": {
      "type": ["string", "null"],
      "description": "Intro paragraph from en Wikipedia (trimmed ~700 chars). CC BY-SA. null = no en Wikipedia article."
    },
    "bio_en_source": {
      "type": ["string", "null"],
      "enum": ["enwiki", null],
      "description": "Provenance of bio_en."
    }
  }
}
