{
  "id": "Q47154",
  "qid": "Q47154",
  "slug": "lucretius",
  "name_zh": "盧克萊修",
  "name_en": "Lucretius",
  "tradition": "greek",
  "centrality": "core",
  "review": true,
  "birth_year": -93,
  "death_year": -54,
  "date_certainty": "exact",
  "active_regions": [
    {
      "lat": 40.750556,
      "lon": 14.489722,
      "place": "Pompeii",
      "period": [
        -93,
        -54
      ],
      "anchor": "birth",
      "source_property": "P19",
      "primary": true,
      "polity_sequence": [
        {
          "polity": "Roman Empire",
          "start": 100,
          "end": 300
        },
        {
          "polity": "Rome (Maximian)",
          "start": 300,
          "end": 400
        },
        {
          "polity": "Western Roman Empire",
          "start": 400,
          "end": 500
        },
        {
          "polity": "Ostrogoths",
          "start": 500,
          "end": 600
        },
        {
          "polity": "Lombard principalities",
          "start": 600,
          "end": 800
        },
        {
          "polity": "Lombard duchies",
          "start": 800,
          "end": 1000
        },
        {
          "polity": "Dutchy of Benevento",
          "start": 1000,
          "end": 1279
        },
        {
          "polity": "Sicily",
          "start": 1279,
          "end": 1492
        },
        {
          "polity": "Aragón",
          "start": 1492,
          "end": 1530
        },
        {
          "polity": "Naples",
          "start": 1530,
          "end": 1783
        },
        {
          "polity": "Kingdom of the Two Sicilies",
          "start": 1783,
          "end": 1880
        },
        {
          "polity": "Italy",
          "start": 1880,
          "end": 1914
        },
        {
          "polity": "Kingfom of Italy",
          "start": 1914,
          "end": 1920
        },
        {
          "polity": "Italy",
          "start": 1920,
          "end": null
        }
      ],
      "polity_source": "historical-basemaps"
    },
    {
      "lat": 41.893055555,
      "lon": 12.482777777,
      "place": "Rome",
      "period": [
        -54,
        -54
      ],
      "anchor": "death",
      "source_property": "P20",
      "primary": false,
      "polity_sequence": [],
      "polity_source": null
    }
  ],
  "membership_sources": [
    {
      "source_id": "iep",
      "entry_type": "canon_list",
      "weight": 1,
      "raw_name": "Lucretius"
    },
    {
      "source_id": "wikidata",
      "entry_type": "dedicated",
      "weight": 1
    }
  ],
  "works": [],
  "works_sources": [],
  "k": 2,
  "sitelinks": 122,
  "birth_place": "Pompeii",
  "description": "1st-century BC Roman poet and philosopher",
  "bio": "提圖斯·陸克瑞提烏斯·卡魯斯（拉丁語：Titus Lucretius Carus，前99年—前55年），羅馬共和國末期的詩人和哲學家，以哲理長詩《物性論》（De Rerum Natura）著稱於世，44歲時自殺身亡。",
  "bio_source": "zhwiki",
  "description_en": "1st-century BC Roman poet and philosopher",
  "bio_en": "Titus Lucretius Carus (  TY-tuhs loo-KREE-shuhs; Latin: [ˈtitʊs lʊˈkreːtɪ.ʊs ˈkaːrʊs]; c. 99 – October 15, 55 BC) was a Roman poet and philosopher. His only known work is the philosophical poem De rerum natura, a didactic work about the tenets and philosophy of Epicureanism, which usually is translated into English as On the Nature of Things—and somewhat less often as On the Nature of the Universe. \nVery little is known about Lucretius's life; the only certainty is that he was either a friend or client of Gaius Memmius, to whom the poem was addressed and dedicated.",
  "bio_en_source": "enwiki"
}